{
  "schemaVersion": 1,
  "run": {
    "id": "11111111-2222-4333-8444-777777777777",
    "startedAt": "2026-09-07T00:02:00Z",
    "mode": "scan",
    "doctorVersion": "0.1.0"
  },
  "host": {
    "binaryInput": "<dsh-home>/bin/dsh",
    "binaryRealpath": "<dsh-home>/bin/dsh",
    "cliVersion": "0.1.1-rc.2",
    "nodeVersion": "26.5.0",
    "corePackages": [
      {
        "name": "@deepseek-ai/dsh-web",
        "version": "0.1.0-rc.9",
        "expectedVersion": "0.1.1-rc.2"
      }
    ]
  },
  "profile": {
    "name": "web",
    "manifestDigest": "sha256:a1b2c3d4a1b2c3d4a1b2c3d4a1b2c3d4a1b2c3d4a1b2c3d4a1b2c3d4a1b2c3d4",
    "lockDigest": "sha256:e5f6a7b8e5f6a7b8e5f6a7b8e5f6a7b8e5f6a7b8e5f6a7b8e5f6a7b8e5f6a7b8"
  },
  "plugins": [
    {
      "name": "@miguel_tu/example-board",
      "loaderIds": ["example-board"],
      "enabled": true,
      "manifestSpecifier": "0.2.9",
      "lockVersion": "0.2.9",
      "actualVersion": "0.2.9",
      "integrity": "sha512-U3ludGhldGljSW50ZWdyaXR5Rm9yR29sZGVuRml4dHVyZU9ubHkzPT0=",
      "status": "declared_compatible",
      "evidenceIds": [
        "@miguel_tu/example-board:engine-range-match#1"
      ],
      "smokeCoverage": {
        "result": "not-run",
        "scope": [],
        "notCovered": ["隔离启动验证（本次 scan 未执行）"],
        "evidenceIds": []
      },
      "uncheckedFeatures": ["插件业务功能（无 smoke 覆盖）"]
    }
  ],
  "findings": [
    {
      "id": "@miguel_tu/example-board:engine-range-match",
      "code": "engine-range-match",
      "subject": "@miguel_tu/example-board",
      "status": "declared_compatible",
      "severity": "info",
      "confidence": "high",
      "observed": "dsh.engines.dsh 声明 >=0.1.1-rc.2，覆盖宿主 0.1.1-rc.2",
      "expected": "引擎声明覆盖当前宿主版本",
      "evidence": [
        {
          "id": "@miguel_tu/example-board:engine-range-match#1",
          "type": "manifest",
          "source": "<profile>/package.json → @miguel_tu/example-board dsh.engines",
          "detail": "插件自身声明一致"
        }
      ],
      "location": "<profile>/package.json",
      "nextStep": "结合 smoke 结果判定是否可放行",
      "blocking": false
    },
    {
      "id": "host:host-version-skew",
      "code": "host-version-skew",
      "subject": "host",
      "status": "degraded",
      "severity": "review",
      "confidence": "high",
      "observed": "@deepseek-ai/dsh-web 实际版本 0.1.0-rc.9",
      "expected": "与宿主 CLI 0.1.1-rc.2 一致的核心包版本",
      "evidence": [
        {
          "id": "host:host-version-skew#1",
          "type": "lock",
          "source": "<profile>/node_modules/@deepseek-ai/dsh-web/package.json",
          "detail": "version 字段与 dsh --version 输出偏移"
        }
      ],
      "location": "<profile>/node_modules/@deepseek-ai/dsh-web/package.json",
      "nextStep": "对齐核心包版本后重新扫描",
      "blocking": false
    }
  ],
  "summary": {
    "status": "degraded",
    "blocking": 0,
    "review": 1
  }
}
